{
  "schemaVersion": "perfectone.unitverify.v1",
  "projectRoot": ".",
  "language": "c",
  "sourceFiles": [
    "samples/c-basic-control/sample2.c"
  ],
  "functions": {
    "mode": "all",
    "value": ""
  },
  "coverageGoal": {
    "line": 100,
    "branch": 100,
    "mcdc": true
  },
  "strategy": [
    "klee",
    "native"
  ],
  "outDir": "Output/sample2_direct"
}
